{
  "subject": "docs/founders-manifesto/1.0.0/founders-manifesto.md",
  "canonicalization": "md-normalized-v1",
  "sha256": "b7c76616cf7c12b60243337e6a3de28ebb5d9ea2d33f1553cd49f71fc0634c7a",
  "signatures": [
    {
      "keyId": "did:key:z6MkProvisionalSteward",
      "alg": "ed25519",
      "jws": "Lx7HgZYZJh70fS9CG1ZVv4GiqKCgrMwZTXmtbKno41N0Rs1fUxjncpdIqkDxYST3i06g0QIiNtvCeJMcJKOdDQ",
      "signedAt": "2025-11-01T05:09:45Z"
    }
  ]
}
